id,title,date,description,digitized,language,subject,location_city,location_state,location_country,image_url,url,item_date_issued,item_created_published,item_medium,item_language,item_newspaper_title,item_lccn,item_place_of_publication
http://www.loc.gov/item/sn86092050/1940-11-22/ed-1/,"the mcdowell times (keystone, w. va.), november 22, 1940",1940-11-22,"keystone, w. va.",True,english,"african americans, mcdowell county, west virginia, mcdowell county (w. va.), keystone, united states, african american, newspapers, mcdowell",keystone,west virginia,united states,https://tile.loc.gov/image-services/iiif/service:ndnp:wvu:batch_wvu_neely_ver01:data:sn86092050:00340582147:1940112201:1088/full/pct:3.125/0/default.jpg#h=271&w=223,https://www.loc.gov/item/sn86092050/1940-11-22/ed-1/,1940-11-22,"keystone, w. va., november 22, 1940",8 pages,eng,the mcdowell times,sn86092050,"keystone, w. va."
http://www.loc.gov/item/sn92066979/1919-08-07/ed-1/,"the laramie republican (laramie, wyo.), august 7, 1919",1919-08-07,"laramie, wyo.",True,english,"albany, united states, laramie (wyo.), albany county, albany county (wyo.), newspapers, laramie, wyoming",laramie,wyoming,united states,https://tile.loc.gov/image-services/iiif/service:ndnp:wyu:batch_wyu_dickinson_ver03:data:sn92066979:00517010030:1919080701:0499/full/pct:6.25/0/default.jpg#h=335&w=245,https://www.loc.gov/item/sn92066979/1919-08-07/ed-1/,1919-08-07,"laramie, wyo., august 7, 1919",8 pages,eng,the laramie republican,sn92066979,"laramie, wyo."
http://www.loc.gov/item/sn84022060/1894-08-24/ed-1/,"the silver state (unionville, nev.), august 24, 1894",1894-08-24,"unionville, nev.",True,english,"united states, humboldt, unionville, winnemucca (nev.), newspapers, nevada, unionville (nev.), winnemucca","unionville, winnemucca",nevada,united states,https://tile.loc.gov/image-services/iiif/service:ndnp:nvln:batch_nvln_carlin_ver01:data:sn84022060:0033289058A:1894082401:0796/full/pct:6.25/0/default.jpg#h=422&w=292,https://www.loc.gov/item/sn84022060/1894-08-24/ed-1/,1894-08-24,"unionville, nev., august 24, 1894",4 pages,eng,the silver state.,sn84022060,"unionville, nev."
http://www.loc.gov/item/sn92070146/1942-05-26/ed-1/,"imperial valley press (el centro, calif.), may 26, 1942",1942-05-26,"el centro, calif.",True,english,"imperial county (calif.), imperial county, san diego county, california, united states, newspapers, san diego county (calif.), el centro, imperial",el centro,california,united states,https://tile.loc.gov/image-services/iiif/service:ndnp:curiv:batch_curiv_sandwort_ver01:data:sn92070146:00414189027:1942052601:0309/full/pct:6.25/0/default.jpg#h=459&w=359,https://www.loc.gov/item/sn92070146/1942-05-26/ed-1/,1942-05-26,"el centro, calif., may 26, 1942",6 pages,eng,imperial valley press,sn92070146,"el centro, calif."
http://www.loc.gov/item/sn82014248/1912-11-18/ed-1/,"daily kennebec journal (augusta, me.), november 18, 1912",1912-11-18,"augusta, me.",True,english,"united states, kennebec county, maine, newspapers, augusta, kennebec county (me.), augusta (me.)",augusta,maine,united states,https://tile.loc.gov/image-services/iiif/service:ndnp:me:batch_me_debsconeag_ver01:data:sn82014248:00513682724:1912111801:0908/full/pct:6.25/0/default.jpg#h=444&w=342,https://www.loc.gov/item/sn82014248/1912-11-18/ed-1/,1912-11-18,"augusta, me., november 18, 1912",10 pages,eng,daily kennebec journal,sn82014248,"augusta, me."
http://www.loc.gov/item/sn84020107/1907-11-16/ed-1/,"the beatrice daily express (beatrice, neb.), november 16, 1907, (evening edition.)",1907-11-16,"beatrice, neb.",True,english,"gage county (neb.), gage, gage county, united states, nebraska, newspapers, beatrice",beatrice,nebraska,united states,https://tile.loc.gov/image-services/iiif/service:ndnp:nbu:batch_nbu_finch_ver01:data:sn84020107:00517014862:1907111601:0500/full/pct:6.25/0/default.jpg#h=433&w=317,https://www.loc.gov/item/sn84020107/1907-11-16/ed-1/,1907-11-16,"beatrice, neb., november 16, 1907",4 pages,eng,the beatrice daily express,sn84020107,"beatrice, neb."
http://www.loc.gov/item/sn88065202/1958-06-26/ed-1/,"the republican (oakland, md.), june 26, 1958",1958-06-26,"oakland, md.",True,english,"oakland (garrett county, md.), maryland, oakland, united states, oakland (garrett county), newspapers, garrett",oakland,maryland,united states,https://tile.loc.gov/image-services/iiif/service:ndnp:mdu:batch_mdu_bufflehead_ver01:data:sn88065202:00340588393:1958062601:0362/full/pct:6.25/0/default.jpg#h=416&w=336,https://www.loc.gov/item/sn88065202/1958-06-26/ed-1/,1958-06-26,"oakland, md., june 26, 1958",12 pages,eng,the republican.,sn88065202,"oakland, md."
http://www.loc.gov/item/sn85042373/1912-09-18/ed-1/,"the evening times (grand forks, n.d.), september 18, 1912",1912-09-18,"grand forks, n.d.",True,english,"grand forks (n.d.), united states, newspapers, grand forks, north dakota",grand forks,north dakota,united states,https://tile.loc.gov/image-services/iiif/service:ndnp:ndhi:batch_ndhi_esmond_ver01:data:sn85042373:00295863146:1912091801:0128/full/pct:3.125/0/default.jpg#h=298&w=219,https://www.loc.gov/item/sn85042373/1912-09-18/ed-1/,1912-09-18,"grand forks, n.d., september 18, 1912",8 pages,eng,the evening times,sn85042373,"grand forks, n.d."
http://www.loc.gov/item/sn88064299/1919-07-04/ed-1/,"the patriot (glenmora, la.), july 4, 1919, (morning)",1919-07-04,"glenmora, la.",True,english,"rapides, united states, glenmora (la.), louisiana, newspapers, glenmora",glenmora,louisiana,united states,https://tile.loc.gov/image-services/iiif/service:ndnp:lu:batch_lu_ivysaur_ver01:data:sn88064299:00295875033:1919070401:0372/full/pct:6.25/0/default.jpg#h=492&w=339,https://www.loc.gov/item/sn88064299/1919-07-04/ed-1/,1919-07-04,"glenmora, la., july 4, 1919",8 pages,eng,the patriot.,sn88064299,"glenmora, la."
http://www.loc.gov/item/sn90051356/1908-05-11/ed-1/,"the daily tribune (florence, colo.), may 11, 1908",1908-05-11,"florence, colo.",True,english,"florence (colo.), colorado, united states, florence, fremont, newspapers",florence,colorado,united states,https://tile.loc.gov/image-services/iiif/service:ndnp:cohi:batch_cohi_carson_ver01:data:sn90051356:0051368065A:1908051101:1285/full/pct:6.25/0/default.jpg#h=321&w=245,https://www.loc.gov/item/sn90051356/1908-05-11/ed-1/,1908-05-11,"florence, colo., may 11, 1908",4 pages,eng,the daily tribune,sn90051356,"florence, colo."
http://www.loc.gov/item/sn83016758/1917-03-15/ed-1/,"the princeton union (princeton, minn.), march 15, 1917",1917-03-15,"princeton, minn.",True,english,"minnesota, mille lacs, princeton (minn.), united states, newspapers, princeton",princeton,minnesota,united states,https://tile.loc.gov/image-services/iiif/service:ndnp:mnhi:batch_mnhi_iron_ver01:data:sn83016758:00280767645:1917031501:0089/full/pct:3.125/0/default.jpg#h=277&w=196,https://www.loc.gov/item/sn83016758/1917-03-15/ed-1/,1917-03-15,"princeton, minn., march 15, 1917",8 pages,eng,the princeton union,sn83016758,"princeton, minn."
http://www.loc.gov/item/sn91064030/1923-07-28/ed-1/,"the pleasantville press (pleasantville, n.j.), july 28, 1923",1923-07-28,"pleasantville, n.j.",True,english,"pleasantville, united states, atlantic, pleasantville (atlantic county), newspapers, new jersey, pleasantville (atlantic county, n.j.)",pleasantville,new jersey,united states,https://tile.loc.gov/image-services/iiif/service:ndnp:njr:batch_njr_harris_ver01:data:sn91064030:00332897007:1923072801:0476/full/pct:6.25/0/default.jpg#h=429&w=317,https://www.loc.gov/item/sn91064030/1923-07-28/ed-1/,1923-07-28,"pleasantville, n.j., july 28, 1923",8 pages,eng,the pleasantville press,sn91064030,"pleasantville, n.j."
http://www.loc.gov/item/sn96090237/1921-09-09/ed-1/,"the kadoka press and kadoka reporter (kadoka, s.d.), september 9, 1921",1921-09-09,"kadoka, s.d.",True,english,"kadoka, jackson, kadoka (s.d.), united states, south dakota, newspapers, jackson county (s.d.), jackson county",kadoka,south dakota,united states,https://tile.loc.gov/image-services/iiif/service:ndnp:sdhi:batch_sdhi_imbe_ver01:data:sn96090237:00340581052:1921090901:0391/full/pct:3.125/0/default.jpg#h=272&w=193,https://www.loc.gov/item/sn96090237/1921-09-09/ed-1/,1921-09-09,"kadoka, s.d., september 9, 1921",4 pages,eng,the kadoka press and kadoka reporter,sn96090237,"kadoka, s.d."
http://www.loc.gov/item/sn93055779/1910-12-12/ed-1/,"the cairo bulletin (cairo, ill.), december 12, 1910",1910-12-12,"cairo, ill.",True,english,"mounds, mounds (ill.), cairo, united states, newspapers, illinois, mound city (ill.), alexander county, cairo (ill.), mound city, alexander county (ill.)",cairo,illinois,united states,https://tile.loc.gov/image-services/iiif/service:ndnp:iune:batch_iune_kerning_ver01:data:sn93055779:00295873115:1910121201:0851/full/pct:6.25/0/default.jpg#h=443&w=325,https://www.loc.gov/item/sn93055779/1910-12-12/ed-1/,1910-12-12,"cairo, ill., december 12, 1910",6 pages,eng,the cairo bulletin,sn93055779,"cairo, ill."
http://www.loc.gov/item/sn86092282/1922-04-06/ed-1/,"randolph enterprise (beverly, w. va.), april 6, 1922",1922-04-06,"beverly, w. va.",True,english,"beverly, randolph, united states, west virginia",beverly,west virginia,united states,https://tile.loc.gov/image-services/iiif/service:ndnp:wvu:batch_wvu_eden_ver01:data:sn86092282:0051701106A:1922040601:0107/full/pct:6.25/0/default.jpg#h=430&w=302,https://www.loc.gov/item/sn86092282/1922-04-06/ed-1/,1922-04-06,"beverly, w. va., april 6, 1922",8 pages,eng,randolph enterprise,sn86092282,"beverly, w. va."
http://www.loc.gov/item/sn82015425/1944-06-27/ed-1/,"atlanta daily world (atlanta, georgia), june 27, 1944, (city edition)",1944-06-27,"atlanta, georgia",True,english,"african americans, georgia, atlanta (ga.), fulton county, united states, fulton, atlanta, african american, newspapers, african american newspapers, fulton county (ga.)",atlanta,georgia,united states,https://tile.loc.gov/image-services/iiif/service:ndnp:gu:batch_gu_dryad_ver03:data:sn82015425:00529040532:1944062701:0963/full/pct:3.125/0/default.jpg#h=296&w=232,https://www.loc.gov/item/sn82015425/1944-06-27/ed-1/,1944-06-27,"atlanta, georgia, june 27, 1944",6 pages,eng,atlanta daily world,sn82015425,"atlanta, georgia"
http://www.loc.gov/item/sn91066932/1941-12-19/ed-1/,"the weekly gazette (east hartford, ct), december 19, 1941",1941-12-19,"east hartford, ct",True,english,"hartford county, hartford county (conn.), hebron, connecticut, https://id.oclc.org/worldcat/entity/e39qbtfrhcr88bghvfxtjxbdcp, united states, east hartford, https://id.oclc.org/worldcat/entity/e39pbjpjj38c94hmdm3bxkykjc, hebron (conn.), newspapers, east hartford (conn.), hartford, https://id.oclc.org/worldcat/entity/e39pbjr3wbgtdh99tjhvgqt4mp",east hartford,connecticut,united states,https://tile.loc.gov/image-services/iiif/service:ndnp:ct:batch_ct_bugmeat_ver01:data:sn91066932:00517174737:1941121901:0923/full/pct:3.125/0/default.jpg#h=296&w=206,https://www.loc.gov/item/sn91066932/1941-12-19/ed-1/,1941-12-19,"east hartford, ct, december 19, 1941",16 pages,eng,the weekly gazette,sn91066932,"east hartford, ct"
http://www.loc.gov/item/sn86075284/1938-03-03/ed-1/,"the poplar standard (poplar, mont.), march 3, 1938",1938-03-03,"poplar, mont.",True,english,"poplar, roosevelt, montana, united states",poplar,montana,united states,https://tile.loc.gov/image-services/iiif/service:ndnp:mthi:batch_mthi_froid_ver01:data:sn86075284:00571718731:1938030301:0301/full/pct:6.25/0/default.jpg#h=352&w=285,https://www.loc.gov/item/sn86075284/1938-03-03/ed-1/,1938-03-03,"poplar, mont., march 3, 1938",4 pages,eng,the poplar standard,sn86075284,"poplar, mont."
http://www.loc.gov/item/sn85038119/1891-04-09/ed-1/,"the hocking sentinel (logan, ohio), april 9, 1891",1891-04-09,"logan, ohio",True,english,"logan, logan (ohio), united states, ohio, newspapers, hocking",logan,ohio,united states,https://tile.loc.gov/image-services/iiif/service:ndnp:ohi:batch_ohi_echo_ver01:data:sn85038119:00237282681:1891040901:0059/full/pct:3.125/0/default.jpg#h=258&w=206,https://www.loc.gov/item/sn85038119/1891-04-09/ed-1/,1891-04-09,"logan, ohio, april 9, 1891",4 pages,eng,the hocking sentinel,sn85038119,"logan, ohio"
http://www.loc.gov/item/sn87062035/1899-07-07/ed-1/,"the daily morning alaskan (skagway, alaska), july 7, 1899",1899-07-07,"skagway, alaska",True,english,"skagway (alaska), united states, skagway, newspapers, alaska",skagway,alaska,united states,https://tile.loc.gov/image-services/iiif/service:ndnp:ak:batch_ak_bluewhale_ver01:data:sn87062035:00279526818:1899070701:0079/full/pct:6.25/0/default.jpg#h=449&w=319,https://www.loc.gov/item/sn87062035/1899-07-07/ed-1/,1899-07-07,"skagway, alaska, july 7, 1899",4 pages,eng,the daily morning alaskan,sn87062035,"skagway, alaska"
http://www.loc.gov/item/sn95070058/1905-03-17/ed-1/,"the norfolk weekly news-journal (norfolk, neb.), march 17, 1905",1905-03-17,"norfolk, neb.",True,english,"united states, norfolk, norfolk (neb.), nebraska, newspapers, madison",norfolk,nebraska,united states,https://tile.loc.gov/image-services/iiif/service:ndnp:nbu:batch_nbu_gering_ver01:data:sn95070058:00206538570:1905031701:0722/full/pct:6.25/0/default.jpg#h=429&w=319,https://www.loc.gov/item/sn95070058/1905-03-17/ed-1/,1905-03-17,"norfolk, neb., march 17, 1905",8 pages,eng,the norfolk weekly news-journal,sn95070058,"norfolk, neb."
http://www.loc.gov/item/sn89051168/1903-11-20/ed-1/,"pine bluff daily graphic (pine bluff, ark.), november 20, 1903",1903-11-20,"pine bluff, ark.",True,english,"https://id.oclc.org/worldcat/entity/e39pbjjt34ykpvxydcwh3wkmt3, jefferson county (ark.), https://id.oclc.org/worldcat/entity/e39pbjxgtmbhxdmvvyyqkycrkd, jefferson, pine bluff, united states, jefferson county, newspapers, pine bluff (ark.), arkansas",pine bluff,arkansas,united states,https://tile.loc.gov/image-services/iiif/service:ndnp:arhi:batch_arhi_genesis_ver01:data:sn89051168:00393343175:1903112001:0214/full/pct:6.25/0/default.jpg#h=457&w=317,https://www.loc.gov/item/sn89051168/1903-11-20/ed-1/,1903-11-20,"pine bluff, ark., november 20, 1903",8 pages,eng,pine bluff daily graphic,sn89051168,"pine bluff, ark."
http://www.loc.gov/item/sn92050145/1915-08-14/ed-1/,"union labor bulletin (little rock, ark.), august 14, 1915",1915-08-14,"little rock, ark.",True,english,"little rock, united states, labor unions, pulaski, newspapers, arkansas",little rock,arkansas,united states,https://tile.loc.gov/image-services/iiif/service:ndnp:arhi:batch_arhi_dioptase_ver02:data:sn92050145:00516990314:1915081401:1073/full/pct:6.25/0/default.jpg#h=358&w=251,https://www.loc.gov/item/sn92050145/1915-08-14/ed-1/,1915-08-14,"little rock, ark., august 14, 1915",4 pages,eng,union labor bulletin,sn92050145,"little rock, ark."
http://www.loc.gov/item/sn87056241/1854-04-20/ed-1/,"plymouth banner (plymouth, marshall county, ind.), april 20, 1854",1854-04-20,"plymouth, marshall county, ind.",True,english,"plymouth (ind.), marshall, united states, indiana, newspapers, plymouth",plymouth,indiana,united states,https://tile.loc.gov/image-services/iiif/service:ndnp:in:batch_in_dillinger_ver02:data:sn87056241:00200295638:1854042001:0257/full/pct:3.125/0/default.jpg#h=332&w=262,https://www.loc.gov/item/sn87056241/1854-04-20/ed-1/,1854-04-20,"plymouth, marshall county, ind., april 20, 1854",4 pages,eng,plymouth banner,sn87056241,"plymouth, marshall county, ind."
http://www.loc.gov/item/sn83030193/1894-08-13/ed-2/,"the evening world (new york, n.y.), august 13, 1894, (brooklyn last edition)",1894-08-13,"new york, n.y.",True,english,"new york (n.y.), new york, new york county, united states, new york county (n.y.), newspapers, new york (state)",new york,new york,united states,https://tile.loc.gov/image-services/iiif/service:ndnp:nn:batch_nn_kobayashi_ver01:data:sn83030193:00206535258:1894081302:0382/full/pct:6.25/0/default.jpg#h=396&w=332,https://www.loc.gov/item/sn83030193/1894-08-13/ed-2/,1894-08-13,"new york, n.y., august 13, 1894",8 pages,eng,the evening world.,sn83030193,"new york, n.y."
http://www.loc.gov/item/2013201074/1900-09-26/ed-1/,"gazeta de puerto-rico (san juan, p.r.), september 26, 1900",1900-09-26,"san juan, p.r.",True,spanish,"san juan (p.r.), san juan, united states, newspapers, puerto rico",san juan,puerto rico,united states,https://tile.loc.gov/image-services/iiif/service:ndnp:prru:batch_prru_galleta_ver01:data:2013201074:00415662956:1900092601:0088/full/pct:3.125/0/default.jpg#h=276&w=197,https://www.loc.gov/item/2013201074/1900-09-26/ed-1/,1900-09-26,"san juan, p.r., september 26, 1900",4 pages,spa,gazeta de puerto-rico.,2013201074,"san juan, p.r."
http://www.loc.gov/item/sn84024735/1833-06-25/ed-1/,"richmond enquirer (richmond, va.), june 25, 1833",1833-06-25,"richmond, va.",True,english,"richmond county (va.), richmond, virginia, united states, richmond (va.), henrico county (va.), newspapers, richmond county, henrico county",richmond,virginia,united states,https://tile.loc.gov/image-services/iiif/service:ndnp:vi:batch_vi_naturals_ver01:data:sn84024735:00414184078:1833062501:0059/full/pct:3.125/0/default.jpg#h=284&w=225,https://www.loc.gov/item/sn84024735/1833-06-25/ed-1/,1833-06-25,"richmond, va., june 25, 1833",4 pages,eng,richmond enquirer,sn84024735,"richmond, va."
http://www.loc.gov/item/sn92063989/1898-03-19/ed-1/,"narragansett herald (narragansett pier, r.i.), march 19, 1898",1898-03-19,"narragansett pier, r.i.",True,english,"narragansett (r.i. : town), hopkinton (r.i. : town), narragansett pier, washington, north kingstown (r.i. : town), united states, rhode island, newspapers",narragansett pier,rhode island,united states,https://tile.loc.gov/image-services/iiif/service:ndnp:rp:batch_rp_gargoyle_ver02:data:sn92063989:00514153437:1898031901:0258/full/pct:3.125/0/default.jpg#h=414&w=313,https://www.loc.gov/item/sn92063989/1898-03-19/ed-1/,1898-03-19,"narragansett pier, r.i., march 19, 1898",8 pages,eng,narragansett herald,sn92063989,"narragansett pier, r.i."
http://www.loc.gov/item/sn85038615/1913-09-13/ed-1/,"the times dispatch (richmond, va.), september 13, 1913",1913-09-13,"richmond, va.",True,english,"richmond, virginia, united states, richmond (va.), newspapers",richmond,virginia,united states,https://tile.loc.gov/image-services/iiif/service:ndnp:vi:batch_vi_sepia_ver01:data:sn85038615:00296020047:1913091301:0437/full/pct:3.125/0/default.jpg#h=270&w=209,https://www.loc.gov/item/sn85038615/1913-09-13/ed-1/,1913-09-13,"richmond, va., september 13, 1913",12 pages,eng,the times dispatch,sn85038615,"richmond, va."
http://www.loc.gov/item/sn84026913/1886-01-21/ed-1/,"the pickens sentinel (pickens, s.c.), january 21, 1886",1886-01-21,"pickens, s.c.",True,english,"pickens, pickens county (s.c.), south carolina, united states, pickens (s.c.), newspapers, pickens county",pickens,south carolina,united states,https://tile.loc.gov/image-services/iiif/service:ndnp:scu:batch_scu_ettabaker_ver02:data:sn84026913:00237288105:1886012101:0394/full/pct:3.125/0/default.jpg#h=290&w=228,https://www.loc.gov/item/sn84026913/1886-01-21/ed-1/,1886-01-21,"pickens, s.c., january 21, 1886",4 pages,eng,the pickens sentinel,sn84026913,"pickens, s.c."
http://www.loc.gov/item/sn95060047/1905-04-19/ed-1/,"yukon valley news (rampart, alaska), april 19, 1905",1905-04-19,"rampart, alaska",True,english,"rampart (alaska), united states, newspapers, rampart, alaska",rampart,alaska,united states,https://tile.loc.gov/image-services/iiif/service:ndnp:ak:batch_ak_killerwhale_ver01:data:sn95060047:00514154132:1905041901:0143/full/pct:6.25/0/default.jpg#h=272&w=203,https://www.loc.gov/item/sn95060047/1905-04-19/ed-1/,1905-04-19,"rampart, alaska, april 19, 1905",4 pages,eng,yukon valley news,sn95060047,"rampart, alaska"
http://www.loc.gov/item/sn89055082/1904-05-26/ed-1/,"the nezperce herald (nezperce, idaho), may 26, 1904",1904-05-26,"nezperce, idaho",True,english,"nezperce (idaho), united states, nezperce, nez perce, newspapers, lewis, idaho",nezperce,idaho,united states,https://tile.loc.gov/image-services/iiif/service:ndnp:idhi:batch_idhi_iguacu_ver01:data:sn89055082:00414211100:1904052601:0093/full/pct:6.25/0/default.jpg#h=420&w=332,https://www.loc.gov/item/sn89055082/1904-05-26/ed-1/,1904-05-26,"nezperce, idaho, may 26, 1904",10 pages,eng,the nezperce herald,sn89055082,"nezperce, idaho"
http://www.loc.gov/item/sn84022044/1876-02-02/ed-1/,"eureka daily sentinel (eureka, nev.), february 2, 1876",1876-02-02,"eureka, nev.",True,english,"united states, eureka, eureka (nev.), newspapers, nevada",eureka,nevada,united states,https://tile.loc.gov/image-services/iiif/service:ndnp:nvln:batch_nvln_sparks_ver01:data:sn84022044:00279555260:1876020201:0019/full/pct:6.25/0/default.jpg#h=440&w=299,https://www.loc.gov/item/sn84022044/1876-02-02/ed-1/,1876-02-02,"eureka, nev., february 2, 1876",4 pages,eng,eureka daily sentinel.,sn84022044,"eureka, nev."
http://www.loc.gov/item/sn85052114/1906-10-09/ed-1/,"the paducah evening sun (paducah, ky.), october 9, 1906",1906-10-09,"paducah, ky.",True,english,"mccracken, kentucky, united states, mccracken county (ky.), newspapers, mccracken county, paducah (ky.), paducah",paducah,kentucky,united states,https://tile.loc.gov/image-services/iiif/service:ndnp:kyu:batch_kyu_meatloaf_ver01:data:sn85052114:00100481741:1906100901:0306/full/pct:6.25/0/default.jpg#h=399&w=313,https://www.loc.gov/item/sn85052114/1906-10-09/ed-1/,1906-10-09,"paducah, ky., october 9, 1906",8 pages,eng,the paducah evening sun,sn85052114,"paducah, ky."
http://www.loc.gov/item/sn89053684/1903-02-13/ed-1/,"the savannah morning news (savannah, ga.), february 13, 1903",1903-02-13,"savannah, ga.",True,english,"georgia, united states, savannah (ga.), savannah, chatham, chatham county, newspapers, chatham county (ga.)",savannah,georgia,united states,https://tile.loc.gov/image-services/iiif/service:ndnp:gu:batch_gu_holmes_ver01:data:sn89053684:00414182392:1903021301:0527/full/pct:3.125/0/default.jpg#h=293&w=215,https://www.loc.gov/item/sn89053684/1903-02-13/ed-1/,1903-02-13,"savannah, ga., february 13, 1903",10 pages,eng,the savannah morning news,sn89053684,"savannah, ga."
http://www.loc.gov/item/sn86076200/1891-01-31/ed-1/,"eureka weekly sentinel (eureka, nev.), january 31, 1891",1891-01-31,"eureka, nev.",True,english,"united states, eureka, eureka (nev.), newspapers, nevada",eureka,nevada,united states,https://tile.loc.gov/image-services/iiif/service:ndnp:nvln:batch_nvln_quartz_ver01:data:sn86076200:00279554115:1891013101:0643/full/pct:6.25/0/default.jpg#h=437&w=308,https://www.loc.gov/item/sn86076200/1891-01-31/ed-1/,1891-01-31,"eureka, nev., january 31, 1891",4 pages,eng,eureka weekly sentinel.,sn86076200,"eureka, nev."
http://www.loc.gov/item/sn83045433/1912-11-15/ed-1/,"the washington herald (washington, d.c.), november 15, 1912",1912-11-15,"washington, d.c.",True,english,"district of columbia, washington (d.c.), washington, united states, newspapers",washington,district of columbia,united states,https://tile.loc.gov/image-services/iiif/service:ndnp:dlc:batch_dlc_deltaair_ver01:data:sn83045433:00294558226:1912111501:0055/full/pct:6.25/0/default.jpg#h=404&w=297,https://www.loc.gov/item/sn83045433/1912-11-15/ed-1/,1912-11-15,"washington, d.c., november 15, 1912",14 pages,eng,the washington herald,sn83045433,"washington, d.c."
http://www.loc.gov/item/sn83030214/1892-01-11/ed-1/,"new-york tribune (new york [n.y.]), january 11, 1892",1892-01-11,new york [n.y.],True,english,"new york (n.y.), new york, new york county, united states, new york county (n.y.), newspapers, new york (state)",new york,new york,united states,https://tile.loc.gov/image-services/iiif/service:ndnp:dlc:batch_dlc_jaguar_ver02:data:sn83030214:0017503853A:1892011101:0148/full/pct:3.125/0/default.jpg#h=366&w=251,https://www.loc.gov/item/sn83030214/1892-01-11/ed-1/,1892-01-11,"new york [n.y.], january 11, 1892",12 pages,eng,new-york tribune,sn83030214,new york [n.y.]
http://www.loc.gov/item/sn89053987/1878-02-06/ed-1/,"the central presbyterian (richmond, va.), february 6, 1878",1878-02-06,"richmond, va.",True,english,"richmond, presbyterian church, virginia, united states, richmond (va.), newspapers, presbyterian church in the united states, presbyterians",richmond,virginia,united states,https://tile.loc.gov/image-services/iiif/service:ndnp:vi:batch_vi_hanhart_ver01:data:sn89053987:print:1878020601:0181/full/pct:3.125/0/default.jpg#h=256&w=192,https://www.loc.gov/item/sn89053987/1878-02-06/ed-1/,1878-02-06,"richmond, va., february 6, 1878",4 pages,eng,the central presbyterian,sn89053987,"richmond, va."
http://www.loc.gov/item/sn87065501/1916-01-15/ed-1/,"water valley progress (water valley, miss.), january 15, 1916",1916-01-15,"water valley, miss.",True,english,"water valley (miss.), united states, mississippi, yalobusha, water valley, newspapers",water valley,mississippi,united states,https://tile.loc.gov/image-services/iiif/service:ndnp:msar:batch_msar_garnet_ver01:data:sn87065501:00383344499:1916011501:1254/full/pct:6.25/0/default.jpg#h=452&w=299,https://www.loc.gov/item/sn87065501/1916-01-15/ed-1/,1916-01-15,"water valley, miss., january 15, 1916",8 pages,eng,water valley progress.,sn87065501,"water valley, miss."
http://www.loc.gov/item/sn99021999/1905-01-31/ed-1/,"omaha daily bee (omaha [neb.]), january 31, 1905",1905-01-31,omaha [neb.],True,english,"united states, omaha, omaha (neb.), nebraska, douglas, newspapers",omaha,nebraska,united states,https://tile.loc.gov/image-services/iiif/service:ndnp:nbu:batch_nbu_norris_ver01:data:sn99021999:00280778175:1905013101:1080/full/pct:6.25/0/default.jpg#h=460&w=351,https://www.loc.gov/item/sn99021999/1905-01-31/ed-1/,1905-01-31,"omaha [neb.], january 31, 1905",10 pages,eng,omaha daily bee,sn99021999,omaha [neb.]
