id,title,date,description,digitized,language,subject,location_city,location_state,location_country,image_url,url,item_date_issued,item_created_published,item_medium,item_language,item_newspaper_title,item_lccn,item_place_of_publication
http://www.loc.gov/item/sn84036012/1896-02-24/ed-1/,"the anaconda standard (anaconda, mont.), february 24, 1896, (morning)",1896-02-24,"anaconda, mont.",True,english,"united states, anaconda, montana, deer lodge, newspapers, anaconda (mont.)",anaconda,montana,united states,https://tile.loc.gov/image-services/iiif/service:ndnp:mthi:batch_mthi_jackrabbit_ver02:data:sn84036012:00294550203:1896022401:0090/full/pct:6.25/0/default.jpg#h=457&w=321,https://www.loc.gov/item/sn84036012/1896-02-24/ed-1/,1896-02-24,"anaconda, mont., february 24, 1896",12 pages,eng,the anaconda standard.,sn84036012,"anaconda, mont."
http://www.loc.gov/item/sn92053934/1898-11-02/ed-1/,"rock island argus (rock island, ill.), november 2, 1898",1898-11-02,"rock island, ill.",True,english,"rock island, east moline (ill.), aledo, mercer county (ill.), united states, rock island county, mercer county, east moline, moline, illinois, rock island (ill.), newspapers, moline (ill.), aledo (ill.)",rock island,illinois,united states,https://tile.loc.gov/image-services/iiif/service:ndnp:iune:batch_iune_folio_ver01:data:sn92053934:0021247194A:1898110201:0481/full/pct:6.25/0/default.jpg#h=448&w=375,https://www.loc.gov/item/sn92053934/1898-11-02/ed-1/,1898-11-02,"rock island, ill., november 2, 1898",6 pages,eng,rock island argus,sn92053934,"rock island, ill."
http://www.loc.gov/item/sn83016689/1917-05-01/ed-1/,"the detroit times (detroit, mich.), may 1, 1917, (noon)",1917-05-01,"detroit, mich.",True,english,"wayne county, detroit (mich.), wayne county (mich.), united states, michigan, wayne, newspapers, detroit",detroit,michigan,united states,https://tile.loc.gov/image-services/iiif/service:ndnp:mimtptc:batch_mimtptc_nazareth_ver01:data:sn83016689:00414218866:1917050101:0224/full/pct:3.125/0/default.jpg#h=292&w=234,https://www.loc.gov/item/sn83016689/1917-05-01/ed-1/,1917-05-01,"detroit, mich., may 1, 1917",8 pages,eng,the detroit times,sn83016689,"detroit, mich."
http://www.loc.gov/item/sn86076247/1923-04-19/ed-1/,"the silver state (winnemucca, nev.), april 19, 1923",1923-04-19,"winnemucca, nev.",True,english,"humboldt, nevada, united states, winnemucca",winnemucca,nevada,united states,https://tile.loc.gov/image-services/iiif/service:ndnp:nvln:batch_nvln_empire_ver01:data:sn86076247:0033289044A:1923041901:0742/full/pct:6.25/0/default.jpg#h=424&w=317,https://www.loc.gov/item/sn86076247/1923-04-19/ed-1/,1923-04-19,"winnemucca, nev., april 19, 1923",10 pages,eng,the silver state.,sn86076247,"winnemucca, nev."
http://www.loc.gov/item/sn84024516/1893-02-11/ed-1/,"the news and observer (raleigh, n.c.), february 11, 1893",1893-02-11,"raleigh, n.c.",True,english,"north carolina, united states, raleigh, wake county, wake county (n.c.), wake, newspapers, raleigh (n.c.)",raleigh,north carolina,united states,https://tile.loc.gov/image-services/iiif/service:ndnp:ncu:batch_ncu_earnhardt_ver01:data:sn84024516:00332891728:1893021101:0508/full/pct:3.125/0/default.jpg#h=288&w=213,https://www.loc.gov/item/sn84024516/1893-02-11/ed-1/,1893-02-11,"raleigh, n.c., february 11, 1893",4 pages,eng,the news and observer,sn84024516,"raleigh, n.c."
http://www.loc.gov/item/sn86091341/1876-04-09/ed-1/,"the weekly elko independent (elko, nev.), april 9, 1876",1876-04-09,"elko, nev.",True,english,"united states, nevada, elko (nev.), newspapers, elko",elko,nevada,united states,https://tile.loc.gov/image-services/iiif/service:ndnp:nvln:batch_nvln_manhattan_ver01:data:sn86091341:00271762604:1876040901:0227/full/pct:6.25/0/default.jpg#h=480&w=350,https://www.loc.gov/item/sn86091341/1876-04-09/ed-1/,1876-04-09,"elko, nev., april 9, 1876",4 pages,eng,the weekly elko independent.,sn86091341,"elko, nev."
http://www.loc.gov/item/sn84026688/1879-06-12/ed-1/,"catoctin clarion (mechanicstown, md.), june 12, 1879",1879-06-12,"mechanicstown, md.",True,english,"thurmont (md.), united states, frederick county, maryland, frederick county (md.), thurmont, frederick, newspapers",thurmont,maryland,united states,https://tile.loc.gov/image-services/iiif/service:ndnp:mdu:batch_mdu_alvarez_ver01:data:sn84026688:0041562346A:1879061201:0964/full/pct:6.25/0/default.jpg#h=461&w=325,https://www.loc.gov/item/sn84026688/1879-06-12/ed-1/,1879-06-12,"mechanicstown, md., june 12, 1879",4 pages,eng,catoctin clarion.,sn84026688,"mechanicstown, md."
http://www.loc.gov/item/sn82016412/1883-08-23/ed-1/,"the daily bulletin (honolulu [hawaii]), august 23, 1883",1883-08-23,honolulu [hawaii],True,english,"hawaii, united states, honolulu (hawaii), newspapers, honolulu",honolulu,hawaii,united states,https://tile.loc.gov/image-services/iiif/service:ndnp:hihouml:batch_hihouml_flying_ver01:data:sn82016412:00294552091:1883082301:0297/full/pct:6.25/0/default.jpg#h=422&w=267,https://www.loc.gov/item/sn82016412/1883-08-23/ed-1/,1883-08-23,"honolulu [hawaii], august 23, 1883",4 pages,eng,the daily bulletin.,sn82016412,honolulu [hawaii]
http://www.loc.gov/item/sn84031081/1912-10-22/ed-1/,"albuquerque morning journal (albuquerque, n.m.), october 22, 1912",1912-10-22,"albuquerque, n.m.",True,english,"albuquerque, new mexico, united states, bernalillo county, albuquerque (n.m.), bernalillo county (n.m.), newspapers, bernalillo",albuquerque,new mexico,united states,https://tile.loc.gov/image-services/iiif/service:ndnp:nmu:batch_nmu_javelina_ver01:data:sn84031081:00296025392:1912102201:0953/full/pct:6.25/0/default.jpg#h=412&w=310,https://www.loc.gov/item/sn84031081/1912-10-22/ed-1/,1912-10-22,"albuquerque, n.m., october 22, 1912",8 pages,eng,albuquerque morning journal.,sn84031081,"albuquerque, n.m."
http://www.loc.gov/item/sn90051081/1917-06-02/ed-1/,"the meeker herald (meeker, colo.), june 2, 1917",1917-06-02,"meeker, colo.",True,english,"rio blanco county (colo.), united states, colorado, rio blanco, garfield, garfield county, meeker (colo.), garfield county (colo.), meeker, newspapers, rio blanco county",meeker,colorado,united states,https://tile.loc.gov/image-services/iiif/service:ndnp:cohi:batch_cohi_halfway_ver01:data:sn90051081:00383341589:1917060201:1135/full/pct:6.25/0/default.jpg#h=286&w=207,https://www.loc.gov/item/sn90051081/1917-06-02/ed-1/,1917-06-02,"meeker, colo., june 2, 1917",4 pages,eng,the meeker herald,sn90051081,"meeker, colo."
http://www.loc.gov/item/sn84023963/1862-04-09/ed-1/,"the jasper weekly courier (jasper, ind.), april 9, 1862",1862-04-09,"jasper, ind.",True,english,"united states, jasper, indiana, newspapers, dubois county, dubois, dubois county (ind.), jasper (ind.)",jasper,indiana,united states,https://tile.loc.gov/image-services/iiif/service:ndnp:in:batch_in_abraham_ver02:data:sn84023963:00200295997:1862040901:0692/full/pct:6.25/0/default.jpg#h=477&w=310,https://www.loc.gov/item/sn84023963/1862-04-09/ed-1/,1862-04-09,"jasper, ind., april 9, 1862",4 pages,eng,the jasper weekly courier,sn84023963,"jasper, ind."
http://www.loc.gov/item/sn86088652/1900-11-27/ed-1/,"bryan morning eagle (bryan, tex.), november 27, 1900",1900-11-27,"bryan, tex.",True,english,"bryan, united states, bryan (tex.), texas, newspapers, brazos",bryan,texas,united states,https://tile.loc.gov/image-services/iiif/service:ndnp:txdn:batch_txdn_infiniti_ver03:data:sn86088652:00200297003:1900112701:0607/full/pct:6.25/0/default.jpg#h=421&w=265,https://www.loc.gov/item/sn86088652/1900-11-27/ed-1/,1900-11-27,"bryan, tex., november 27, 1900",4 pages,eng,bryan morning eagle,sn86088652,"bryan, tex."
http://www.loc.gov/item/sn87065069/1912-06-27/ed-1/,"the jones county news (ellisville, miss.), june 27, 1912",1912-06-27,"ellisville, miss.",True,english,"united states, mississippi, jones, newspapers, ellisville (miss.), ellisville",ellisville,mississippi,united states,https://tile.loc.gov/image-services/iiif/service:ndnp:msar:batch_msar_karakul_ver02:data:sn87065069:00199917614:1912062701:1119/full/pct:6.25/0/default.jpg#h=346&w=233,https://www.loc.gov/item/sn87065069/1912-06-27/ed-1/,1912-06-27,"ellisville, miss., june 27, 1912",10 pages,eng,the jones county news.,sn87065069,"ellisville, miss."
http://www.loc.gov/item/sn86076142/1921-06-10/ed-1/,"tonopah daily bonanza (tonopah, nev.), june 10, 1921",1921-06-10,"tonopah, nev.",True,english,"mines and mineral resources, united states, tonopah (nev.), tonopah, nevada, nye, newspapers",tonopah,nevada,united states,https://tile.loc.gov/image-services/iiif/service:ndnp:nvln:batch_nvln_beatty_ver02:data:sn86076142:00415627075:1921061001:0552/full/pct:6.25/0/default.jpg#h=388&w=278,https://www.loc.gov/item/sn86076142/1921-06-10/ed-1/,1921-06-10,"tonopah, nev., june 10, 1921",4 pages,eng,tonopah daily bonanza.,sn86076142,"tonopah, nev."
http://www.loc.gov/item/sn84038582/1890-08-02/ed-1/,"the ottawa free trader (ottawa, ill.), august 2, 1890",1890-08-02,"ottawa, ill.",True,english,"ottawa (ill.), la salle county, ottawa, united states, la salle county (ill.), illinois, newspapers",ottawa,illinois,united states,https://tile.loc.gov/image-services/iiif/service:ndnp:iune:batch_iune_cataloging_ver01:data:sn84038582:00212471586:1890080201:0311/full/pct:6.25/0/default.jpg#h=476&w=316,https://www.loc.gov/item/sn84038582/1890-08-02/ed-1/,1890-08-02,"ottawa, ill., august 2, 1890",10 pages,eng,the ottawa free trader,sn84038582,"ottawa, ill."
http://www.loc.gov/item/sn96088042/1910-03-31/ed-1/,"wallowa county chieftain (enterprise, or.), march 31, 1910",1910-03-31,"enterprise, or.",True,english,"wallowa county, enterprise (or.), united states, wallowa, oregon, enterprise, wallowa county (or.), newspapers",enterprise,oregon,united states,https://tile.loc.gov/image-services/iiif/service:ndnp:oru:batch_oru_egret_ver01:data:sn96088042:00200294877:1910033101:0917/full/pct:6.25/0/default.jpg#h=414&w=285,https://www.loc.gov/item/sn96088042/1910-03-31/ed-1/,1910-03-31,"enterprise, or., march 31, 1910",6 pages,eng,wallowa county chieftain,sn96088042,"enterprise, or."
http://www.loc.gov/item/sn85033429/1896-12-09/ed-1/,"herald and tribune (jonesborough, tenn.), december 9, 1896",1896-12-09,"jonesborough, tenn.",True,english,"washington county, washington county (tenn.), united states, tennessee, jonesborough, washington, newspapers, jonesborough (tenn.)",jonesborough,tennessee,united states,https://tile.loc.gov/image-services/iiif/service:ndnp:tu:batch_tu_brownie_ver01:data:sn85033429:00280779337:1896120901:0962/full/pct:6.25/0/default.jpg#h=465&w=325,https://www.loc.gov/item/sn85033429/1896-12-09/ed-1/,1896-12-09,"jonesborough, tenn., december 9, 1896",4 pages,eng,herald and tribune.,sn85033429,"jonesborough, tenn."
http://www.loc.gov/item/sn84022109/1884-09-24/ed-1/,"the waco daily examiner (waco, tex.), september 24, 1884",1884-09-24,"waco, tex.",True,english,"waco (tex.), united states, mclennan, waco, texas, newspapers",waco,texas,united states,https://tile.loc.gov/image-services/iiif/service:ndnp:txdn:batch_txdn_kilo_ver02:data:sn84022109:0021110188A:1884092401:0728/full/pct:6.25/0/default.jpg#h=412&w=313,https://www.loc.gov/item/sn84022109/1884-09-24/ed-1/,1884-09-24,"waco, tex., september 24, 1884",4 pages,eng,the waco daily examiner,sn84022109,"waco, tex."
http://www.loc.gov/item/sn86086632/1897-03-09/ed-1/,"the copper country evening news (calumet, mich.), march 9, 1897",1897-03-09,"calumet, mich.",True,english,"houghton county (mich.), united states, houghton county, houghton, michigan, newspapers, calumet (mich.), calumet",calumet,michigan,united states,https://tile.loc.gov/image-services/iiif/service:ndnp:mimtptc:batch_mimtptc_calumet_ver01:data:sn86086632:00296023486:1897030901:0572/full/pct:3.125/0/default.jpg#h=280&w=185,https://www.loc.gov/item/sn86086632/1897-03-09/ed-1/,1897-03-09,"calumet, mich., march 9, 1897",8 pages,eng,the copper country evening news,sn86086632,"calumet, mich."
http://www.loc.gov/item/sn86063496/1918-03-15/ed-1/,"yidishes ṭageblaṭṭ = the jewish daily news (new york, n.y.), march 15, 1918",1918-03-15,"new york, n.y.",True,"english, yiddish","sources, united states, new york county (n.y.), new york county, new york (state), jewish, new york (n.y.), history, jews, jewish newspapers, newspapers, new york",new york,new york,united states,https://tile.loc.gov/image-services/iiif/service:ndnp:dlc:batch_dlc_astrotrain_ver02:data:sn86063496:00542863122:1918031501:0523/full/pct:3.125/0/default.jpg#h=295&w=210,https://www.loc.gov/item/sn86063496/1918-03-15/ed-1/,1918-03-15,"new york, n.y., march 15, 1918",12 pages,"yid, eng",yidishes ṭageblaṭṭ = the jewish daily news,sn86063496,"new york, n.y."
http://www.loc.gov/item/sn83045863/1945-04-07/ed-1/,"the guardian (boston, mass.), april 7, 1945",1945-04-07,"boston, mass.",True,english,"boston (mass.), african american, united states, suffolk, african americans, boston, massachusetts, newspapers, new england",boston,massachusetts,united states,https://tile.loc.gov/image-services/iiif/service:ndnp:mb:batch_mb_circe_ver01:data:sn83045863:00517171918:1945040701:0079/full/pct:3.125/0/default.jpg#h=257&w=193,https://www.loc.gov/item/sn83045863/1945-04-07/ed-1/,1945-04-07,"boston, mass., april 7, 1945",6 pages,eng,the guardian,sn83045863,"boston, mass."
http://www.loc.gov/item/sn86058250/1862-05-24/ed-1/,"the richmond palladium (richmond, ind.), may 24, 1862",1862-05-24,"richmond, ind.",True,english,"wayne county, united states, richmond (ind.), indiana, wayne, newspapers, wayne county (ind.), richmond",richmond,indiana,united states,https://tile.loc.gov/image-services/iiif/service:ndnp:in:batch_in_indianapolisolympians_ver02:data:sn86058250:0027174478A:1862052401:0058/full/pct:6.25/0/default.jpg#h=504&w=412,https://www.loc.gov/item/sn86058250/1862-05-24/ed-1/,1862-05-24,"richmond, ind., may 24, 1862",4 pages,eng,the richmond palladium,sn86058250,"richmond, ind."
http://www.loc.gov/item/sn84031081/1911-08-28/ed-1/,"albuquerque morning journal (albuquerque, n.m.), august 28, 1911",1911-08-28,"albuquerque, n.m.",True,english,"albuquerque, new mexico, united states, bernalillo county, albuquerque (n.m.), bernalillo county (n.m.), newspapers, bernalillo",albuquerque,new mexico,united states,https://tile.loc.gov/image-services/iiif/service:ndnp:nmu:batch_nmu_javelina_ver01:data:sn84031081:00296025379:1911082801:0500/full/pct:6.25/0/default.jpg#h=436&w=303,https://www.loc.gov/item/sn84031081/1911-08-28/ed-1/,1911-08-28,"albuquerque, n.m., august 28, 1911",6 pages,eng,albuquerque morning journal.,sn84031081,"albuquerque, n.m."
http://www.loc.gov/item/sn92067221/1889-10-03/ed-1/,"platte valley lyre (saratoga, wyo.), october 3, 1889",1889-10-03,"saratoga, wyo.",True,english,"united states, carbon, wyoming, saratoga (wyo.), saratoga, carbon county, newspapers, carbon county (wyo.)",saratoga,wyoming,united states,https://tile.loc.gov/image-services/iiif/service:ndnp:wyu:batch_wyu_karig_ver02:data:sn92067221:00514150114:1889100301:0313/full/pct:6.25/0/default.jpg#h=299&w=203,https://www.loc.gov/item/sn92067221/1889-10-03/ed-1/,1889-10-03,"saratoga, wyo., october 3, 1889",4 pages,eng,platte valley lyre,sn92067221,"saratoga, wyo."
http://www.loc.gov/item/sn84020657/1925-05-29/ed-1/,"the alaska daily empire (juneau, alaska), may 29, 1925",1925-05-29,"juneau, alaska",True,english,"alaska, united states, newspapers, juneau, juneau (alaska)",juneau,alaska,united states,https://tile.loc.gov/image-services/iiif/service:ndnp:ak:batch_ak_goshawk_ver01:data:sn84020657:00393342067:1925052901:0199/full/pct:6.25/0/default.jpg#h=413&w=325,https://www.loc.gov/item/sn84020657/1925-05-29/ed-1/,1925-05-29,"juneau, alaska, may 29, 1925",8 pages,eng,the alaska daily empire,sn84020657,"juneau, alaska"
http://www.loc.gov/item/sn90059522/1888-09-18/ed-1/,"st. paul daily globe (saint paul, minn.), september 18, 1888",1888-09-18,"saint paul, minn.",True,english,"saint paul, minnesota, united states, ramsey, saint paul (minn.), newspapers",saint paul,minnesota,united states,https://tile.loc.gov/image-services/iiif/service:ndnp:mnhi:batch_mnhi_kasota_ver01:data:sn90059522:0017503335A:1888091801:0201/full/pct:3.125/0/default.jpg#h=273&w=206,https://www.loc.gov/item/sn90059522/1888-09-18/ed-1/,1888-09-18,"saint paul, minn., september 18, 1888",11 pages,eng,st. paul daily globe,sn90059522,"saint paul, minn."
http://www.loc.gov/item/sn88064005/1883-06-23/ed-1/,"the meridional (abbeville, la.), june 23, 1883, (english)",1883-06-23,"abbeville, la.",True,"english, french","newspapers, vermilion parish, united states, abbeville, vermilion, louisiana, vermilion parish (la.), abbeville (la.)",abbeville,louisiana,united states,https://tile.loc.gov/image-services/iiif/service:ndnp:lu:batch_lu_emmet_ver01:data:sn88064005:00200299048:1883062301:0213/full/pct:6.25/0/default.jpg#h=467&w=310,https://www.loc.gov/item/sn88064005/1883-06-23/ed-1/,1883-06-23,"abbeville, la., june 23, 1883",2 pages,"eng, fre",the meridional.,sn88064005,"abbeville, la."
http://www.loc.gov/item/sn83035216/1860-03-03/ed-1/,"ashtabula weekly telegraph (ashtabula, ohio), march 3, 1860",1860-03-03,"ashtabula, ohio",True,english,"united states, ohio, ashtabula (ohio), newspapers, ashtabula",ashtabula,ohio,united states,https://tile.loc.gov/image-services/iiif/service:ndnp:ohi:batch_ohi_guildenstern_ver01:data:sn83035216:00280775150:1860030301:0381/full/pct:6.25/0/default.jpg#h=476&w=364,https://www.loc.gov/item/sn83035216/1860-03-03/ed-1/,1860-03-03,"ashtabula, ohio, march 3, 1860",4 pages,eng,ashtabula weekly telegraph,sn83035216,"ashtabula, ohio"
http://www.loc.gov/item/sn85040437/1921-11-17/ed-1/,"the washburn times (washburn, wis.), november 17, 1921",1921-11-17,"washburn, wis.",True,english,"united states, washburn, wisconsin, bayfield, newspapers, washburn (wis.)",washburn,wisconsin,united states,https://tile.loc.gov/image-services/iiif/service:ndnp:whi:batch_whi_erkling_ver02:data:sn85040437:00414215208:1921111701:0025/full/pct:3.125/0/default.jpg#h=308&w=247,https://www.loc.gov/item/sn85040437/1921-11-17/ed-1/,1921-11-17,"washburn, wis., november 17, 1921",8 pages,eng,the washburn times,sn85040437,"washburn, wis."
http://www.loc.gov/item/sn84027457/1875-05-01/ed-1/,"las vegas gazette (las vegas, n.m.), may 1, 1875",1875-05-01,"las vegas, n.m.",True,"spanish, english","new mexico, san miguel county (n.m.), united states, san miguel county, san miguel, las vegas, las vegas (n.m.), newspapers",las vegas,new mexico,united states,https://tile.loc.gov/image-services/iiif/service:ndnp:nmu:batch_nmu_elk_ver01:data:sn84027457:00296024818:1875050101:0415/full/pct:6.25/0/default.jpg#h=458&w=310,https://www.loc.gov/item/sn84027457/1875-05-01/ed-1/,1875-05-01,"las vegas, n.m., may 1, 1875",4 pages,"eng, spa",las vegas gazette.,sn84027457,"las vegas, n.m."
http://www.loc.gov/item/sn84022044/1874-06-09/ed-1/,"eureka daily sentinel (eureka, nev.), june 9, 1874",1874-06-09,"eureka, nev.",True,english,"united states, nevada, newspapers, eureka, eureka (nev.)",eureka,nevada,united states,https://tile.loc.gov/image-services/iiif/service:ndnp:nvln:batch_nvln_quartz_ver01:data:sn84022044:00279554826:1874060901:0523/full/pct:6.25/0/default.jpg#h=428&w=283,https://www.loc.gov/item/sn84022044/1874-06-09/ed-1/,1874-06-09,"eureka, nev., june 9, 1874",4 pages,eng,eureka daily sentinel.,sn84022044,"eureka, nev."
http://www.loc.gov/item/sn89051168/1918-04-13/ed-1/,"pine bluff daily graphic (pine bluff, ark.), april 13, 1918",1918-04-13,"pine bluff, ark.",True,english,"jefferson, pine bluff, arkansas, pine bluff (ark.), https://id.oclc.org/worldcat/entity/e39pbjjt34ykpvxydcwh3wkmt3, united states, https://id.oclc.org/worldcat/entity/e39pbjxgtmbhxdmvvyyqkycrkd, jefferson county (ark.), newspapers, jefferson county",pine bluff,arkansas,united states,https://tile.loc.gov/image-services/iiif/service:ndnp:arhi:batch_arhi_kraftwerk_ver01:data:sn89051168:00393343497:1918041301:0540/full/pct:6.25/0/default.jpg#h=450&w=338,https://www.loc.gov/item/sn89051168/1918-04-13/ed-1/,1918-04-13,"pine bluff, ark., april 13, 1918",12 pages,eng,pine bluff daily graphic,sn89051168,"pine bluff, ark."
http://www.loc.gov/item/sn84024271/1944-10-05/ed-1/,"the lexington advertiser (lexington, miss.), october 5, 1944",1944-10-05,"lexington, miss.",True,english,"holmes, united states, mississippi, lexington (miss.), lexington, newspapers",lexington,mississippi,united states,https://tile.loc.gov/image-services/iiif/service:ndnp:msar:batch_msar_jasper_ver01:data:sn84024271:00383344815:1944100501:0684/full/pct:6.25/0/default.jpg#h=459&w=312,https://www.loc.gov/item/sn84024271/1944-10-05/ed-1/,1944-10-05,"lexington, miss., october 5, 1944",8 pages,eng,the lexington advertiser.,sn84024271,"lexington, miss."
http://www.loc.gov/item/sn82015415/1900-09-14/ed-1/,"the hawaiian star (honolulu [oahu]), september 14, 1900",1900-09-14,honolulu [oahu],True,english,"hawaii, united states, honolulu, newspapers",honolulu,hawaii,united states,https://tile.loc.gov/image-services/iiif/service:ndnp:hihouml:batch_hihouml_brick_ver01:data:sn82015415:00237283880:1900091401:0091/full/pct:6.25/0/default.jpg#h=400&w=288,https://www.loc.gov/item/sn82015415/1900-09-14/ed-1/,1900-09-14,"honolulu [oahu], september 14, 1900",8 pages,eng,the hawaiian star.,sn82015415,honolulu [oahu]
http://www.loc.gov/item/sn90051300/1906-04-05/ed-1/,"the elbert county tribune (elbert, elbert county, colo.), april 5, 1906",1906-04-05,"elbert, elbert county, colo.",True,english,"elbert (colo.), united states, elbert, colorado, newspapers",elbert,colorado,united states,https://tile.loc.gov/image-services/iiif/service:ndnp:cohi:batch_cohi_jasper_ver01:data:sn90051300:00340586128:1906040501:0619/full/pct:6.25/0/default.jpg#h=306&w=226,https://www.loc.gov/item/sn90051300/1906-04-05/ed-1/,1906-04-05,"elbert, elbert county, colo., april 5, 1906",8 pages,eng,the elbert county tribune,sn90051300,"elbert, elbert county, colo."
http://www.loc.gov/item/sn88085460/1903-03-06/ed-1/,"the colfax gazette (colfax, wash.), march 6, 1903",1903-03-06,"colfax, wash.",True,english,"colfax (wash.), united states, whitman, washington, newspapers, washington (state), colfax",colfax,washington,united states,https://tile.loc.gov/image-services/iiif/service:ndnp:wa:batch_wa_alder_ver01:data:sn88085460:00211108228:1903030601:0223/full/pct:3.125/0/default.jpg#h=277&w=195,https://www.loc.gov/item/sn88085460/1903-03-06/ed-1/,1903-03-06,"colfax, wash., march 6, 1903",8 pages,eng,the colfax gazette,sn88085460,"colfax, wash."
http://www.loc.gov/item/sn88084068/1932-01-06/ed-1/,"arkansas echo (little rock, ark.), january 6, 1932",1932-01-06,"little rock, ark.",True,german,"arkansas, united states, little rock, pulaski, https://id.oclc.org/worldcat/entity/e39pbjqbtvcc6bxmqb84m8xv73, germans, german, newspapers, little rock (ark.)",little rock,arkansas,united states,https://tile.loc.gov/image-services/iiif/service:ndnp:arhi:batch_arhi_kepler_ver01:data:sn88084068:print:1932010601:0001/full/pct:3.125/0/default.jpg#h=267&w=189,https://www.loc.gov/item/sn88084068/1932-01-06/ed-1/,1932-01-06,"little rock, ark., january 6, 1932",8 pages,ger,arkansas echo,sn88084068,"little rock, ark."
http://www.loc.gov/item/sn86090827/1873-06-07/ed-1/,"rapides gazette (alexandria, la.), june 7, 1873",1873-06-07,"alexandria, la.",True,english,"newspapers, alexandria (la.), rapides parish (la.), united states, rapides, rapides parish, louisiana, alexandria",alexandria,louisiana,united states,https://tile.loc.gov/image-services/iiif/service:ndnp:lu:batch_lu_quentin_ver01:data:sn86090827:00200299991:1873060701:0301/full/pct:6.25/0/default.jpg#h=469&w=315,https://www.loc.gov/item/sn86090827/1873-06-07/ed-1/,1873-06-07,"alexandria, la., june 7, 1873",4 pages,eng,rapides gazette.,sn86090827,"alexandria, la."
http://www.loc.gov/item/sn83009653/1912-05-28/ed-1/,"oxford democrat (paris, me.), may 28, 1912",1912-05-28,"paris, me.",True,english,"united states, paris, paris (me.), south paris (me.), oxford, south paris, maine, newspapers","paris, south paris",maine,united states,https://tile.loc.gov/image-services/iiif/service:ndnp:me:batch_me_baxter_ver01:data:sn83009653:00279524202:1912052801:0509/full/pct:3.125/0/default.jpg#h=324&w=245,https://www.loc.gov/item/sn83009653/1912-05-28/ed-1/,1912-05-28,"paris, me., may 28, 1912",4 pages,eng,oxford democrat,sn83009653,"paris, me."
http://www.loc.gov/item/sn85038115/1870-09-06/ed-1/,"the spirit of democracy (woodsfield, ohio), september 6, 1870",1870-09-06,"woodsfield, ohio",True,english,"monroe, woodsfield, united states, ohio, newspapers, woodsfield (ohio)",woodsfield,ohio,united states,https://tile.loc.gov/image-services/iiif/service:ndnp:ohi:batch_ohi_byrd_ver01:data:sn85038115:00296027443:1870090601:0444/full/pct:3.125/0/default.jpg#h=276&w=204,https://www.loc.gov/item/sn85038115/1870-09-06/ed-1/,1870-09-06,"woodsfield, ohio, september 6, 1870",4 pages,eng,the spirit of democracy,sn85038115,"woodsfield, ohio"
http://www.loc.gov/item/sn83030193/1889-07-03/ed-1/,"the evening world (new york, n.y.), july 3, 1889, (extra 2 o'clock)",1889-07-03,"new york, n.y.",True,english,"new york (n.y.), new york, new york county, united states, new york county (n.y.), newspapers, new york (state)",new york,new york,united states,https://tile.loc.gov/image-services/iiif/service:ndnp:nn:batch_nn_hanyu_ver01:data:sn83030193:00206539513:1889070301:0348/full/pct:6.25/0/default.jpg#h=406&w=336,https://www.loc.gov/item/sn83030193/1889-07-03/ed-1/,1889-07-03,"new york, n.y., july 3, 1889",4 pages,eng,the evening world.,sn83030193,"new york, n.y."
