id,title,date,description,digitized,language,subject,location_city,location_state,location_country,image_url,url,item_date_issued,item_created_published,item_medium,item_language,item_newspaper_title,item_lccn,item_place_of_publication
http://www.loc.gov/item/sn89064489/1922-12-21/ed-1/,"the sauk centre herald (sauk centre, stearns county, minn.), december 21, 1922",1922-12-21,"sauk centre, stearns county, minn.",True,english,"stearns, minnesota, stearns county, stearns county (minn.), united states, sauk centre, sauk centre (minn.), newspapers",sauk centre,minnesota,united states,https://tile.loc.gov/image-services/iiif/service:ndnp:mnhi:batch_mnhi_archery_ver01:data:sn89064489:0034058997A:1922122101:0436/full/pct:3.125/0/default.jpg#h=272&w=189,https://www.loc.gov/item/sn89064489/1922-12-21/ed-1/,1922-12-21,"sauk centre, stearns county, minn., december 21, 1922",16 pages,eng,the sauk centre herald,sn89064489,"sauk centre, stearns county, minn."
http://www.loc.gov/item/sn86091104/1915-03-26/ed-1/,"the record (st. maries, idaho), march 26, 1915",1915-03-26,"st. maries, idaho",True,english,"united states, saint maries (idaho), saint maries, benewah, newspapers, kootenai, idaho",saint maries,idaho,united states,https://tile.loc.gov/image-services/iiif/service:ndnp:idhi:batch_idhi_bagrati_ver02:data:sn86091104:00279551084:1915032601:0882/full/pct:6.25/0/default.jpg#h=427&w=304,https://www.loc.gov/item/sn86091104/1915-03-26/ed-1/,1915-03-26,"st. maries, idaho, march 26, 1915",4 pages,eng,the record,sn86091104,"st. maries, idaho"
http://www.loc.gov/item/sn85052141/1886-05-14/ed-1/,"the hickman courier (hickman, ky.), may 14, 1886",1886-05-14,"hickman, ky.",True,english,"fulton county (ky.), kentucky, fulton county, united states, fulton, hickman (ky.), newspapers, hickman",hickman,kentucky,united states,https://tile.loc.gov/image-services/iiif/service:ndnp:kyu:batch_kyu_dracula_ver01:data:sn85052141:0020653364A:1886051401:0487/full/pct:3.125/0/default.jpg#h=299&w=227,https://www.loc.gov/item/sn85052141/1886-05-14/ed-1/,1886-05-14,"hickman, ky., may 14, 1886",4 pages,eng,the hickman courier,sn85052141,"hickman, ky."
http://www.loc.gov/item/sn84025840/1942-11-20/ed-1/,"arkansas state press (little rock, ark.), november 20, 1942",1942-11-20,"little rock, ark.",True,english,"arkansas, african american, united states, little rock, african americans, pulaski, https://id.oclc.org/worldcat/entity/e39pbjqbtvcc6bxmqb84m8xv73, https://id.oclc.org/worldcat/entity/e39pbjwmwphdmfdmkff9vdjt8c, newspapers, little rock (ark.)",little rock,arkansas,united states,https://tile.loc.gov/image-services/iiif/service:ndnp:arhi:batch_arhi_blackhole_ver01:data:sn84025840:00513687709:1942112001:0393/full/pct:6.25/0/default.jpg#h=445&w=317,https://www.loc.gov/item/sn84025840/1942-11-20/ed-1/,1942-11-20,"little rock, ark., november 20, 1942",8 pages,eng,arkansas state press,sn84025840,"little rock, ark."
http://www.loc.gov/item/sn84024013/1810-09-01/ed-1/,"alexandria daily gazette, commercial & political (alexandria [va.]), september 1, 1810",1810-09-01,alexandria [va.],True,english,"united states, washington (d.c.), alexandria county (va.), alexandria, newspapers, alexandria county, alexandria (va.), virginia",alexandria,virginia,united states,https://tile.loc.gov/image-services/iiif/service:ndnp:vi:batch_vi_flyingsquirrels_ver03:data:sn84024013:00414216122:1810090101:0211/full/pct:3.125/0/default.jpg#h=344&w=203,https://www.loc.gov/item/sn84024013/1810-09-01/ed-1/,1810-09-01,"alexandria [va.], september 1, 1810",4 pages,eng,"alexandria daily gazette, commercial & political",sn84024013,alexandria [va.]
http://www.loc.gov/item/sn83045747/1914-12-22/ed-1/,"dziennik chicagoski (chicago [ill.]), december 22, 1914",1914-12-22,chicago [ill.],True,"english, polish","polish americans, polish, united states, chicago (ill.), cook, polish people, stany zjednoczone, illinois, czasopisma, chicago, newspapers, polacy",chicago,illinois,united states,https://tile.loc.gov/image-services/iiif/service:ndnp:iune:batch_iune_edelweiss_ver03:data:sn83045747:00279553044:1914122201:0415/full/pct:3.125/0/default.jpg#h=305&w=209,https://www.loc.gov/item/sn83045747/1914-12-22/ed-1/,1914-12-22,"chicago [ill.], december 22, 1914",8 pages,"pol, eng",dziennik chicagoski,sn83045747,chicago [ill.]
http://www.loc.gov/item/sn83016368/1874-11-28/ed-1/,"the baltimore county union (towsontown, md.), november 28, 1874",1874-11-28,"towsontown, md.",True,english,"baltimore county, united states, towson (md.), maryland, baltimore, newspapers, towson, baltimore county (md.)",towson,maryland,united states,https://tile.loc.gov/image-services/iiif/service:ndnp:mdu:batch_mdu_indianhead_ver01:data:sn83016368:00415627518:1874112801:0122/full/pct:3.125/0/default.jpg#h=300&w=220,https://www.loc.gov/item/sn83016368/1874-11-28/ed-1/,1874-11-28,"towsontown, md., november 28, 1874",4 pages,eng,the baltimore county union.,sn83016368,"towsontown, md."
http://www.loc.gov/item/sn83025588/1802-04-13/ed-1/,"the new hampshire gazette (portsmouth [n.h.]), april 13, 1802",1802-04-13,portsmouth [n.h.],True,english,"new hampshire, rockingham county (n.h.), united states, rockingham, portsmouth, rockingham county, newspapers, portsmouth (n.h.)",portsmouth,new hampshire,united states,https://tile.loc.gov/image-services/iiif/service:ndnp:nhd:batch_nhd_avalon_ver02:data:sn83025588:00517010789:1802041301:0059/full/pct:3.125/0/default.jpg#h=310&w=201,https://www.loc.gov/item/sn83025588/1802-04-13/ed-1/,1802-04-13,"portsmouth [n.h.], april 13, 1802",4 pages,eng,the new hampshire gazette,sn83025588,portsmouth [n.h.]
http://www.loc.gov/item/sn83030214/1916-08-24/ed-1/,"new-york tribune (new york [n.y.]), august 24, 1916",1916-08-24,new york [n.y.],True,english,"https://id.oclc.org/worldcat/entity/e39qbtfrvqh7864jh4rdgbfdwc, united states, new york county (n.y.), new york county, new york (state), new york (n.y.), newspapers, new york, https://id.oclc.org/worldcat/entity/e39pbjpj8ktvrv6gp6v6tp7pwc",new york,new york,united states,https://tile.loc.gov/image-services/iiif/service:ndnp:dlc:batch_dlc_self_ver02:data:sn83030214:0020653204A:1916082401:0449/full/pct:3.125/0/default.jpg#h=265&w=198,https://www.loc.gov/item/sn83030214/1916-08-24/ed-1/,1916-08-24,"new york [n.y.], august 24, 1916",14 pages,eng,new-york tribune,sn83030214,new york [n.y.]
http://www.loc.gov/item/sn84024739/1773-07-08/ed-1/,"the virginia gazette (williamsburg [va.]), july 8, 1773",1773-07-08,williamsburg [va.],True,english,"richmond county, https://id.oclc.org/worldcat/entity/e39pbjf8r9b7vx8ggjp89746rq, united states, williamsburg, richmond county (va.), https://id.oclc.org/worldcat/entity/e39pbjtccxfgd9kg99kkhbygkd, richmond (va.), newspapers, williamsburg (va.), https://id.oclc.org/worldcat/entity/e39pbjw8wcxxkrmycfyfccpvpp, virginia, richmond","richmond, williamsburg",virginia,united states,https://tile.loc.gov/image-services/iiif/service:ndnp:vi:batch_vi_invicta_ver01:data:sn84024739:print:1773070801:0109/full/pct:6.25/0/default.jpg#h=325&w=201,https://www.loc.gov/item/sn84024739/1773-07-08/ed-1/,1773-07-08,"williamsburg [va.], july 8, 1773",2 pages,eng,the virginia gazette,sn84024739,williamsburg [va.]
http://www.loc.gov/item/sn83045366/1906-11-28/ed-1/,"the minneapolis journal (minneapolis, minn.), november 28, 1906",1906-11-28,"minneapolis, minn.",True,english,"minnesota, united states, minneapolis, minneapolis (minn.), hennepin, newspapers",minneapolis,minnesota,united states,https://tile.loc.gov/image-services/iiif/service:ndnp:mnhi:batch_mnhi_dunbar_ver01:data:sn83045366:00206538454:1906112801:0301/full/pct:3.125/0/default.jpg#h=297&w=212,https://www.loc.gov/item/sn83045366/1906-11-28/ed-1/,1906-11-28,"minneapolis, minn., november 28, 1906",14 pages,eng,the minneapolis journal,sn83045366,"minneapolis, minn."
http://www.loc.gov/item/sn82015425/1933-10-03/ed-1/,"atlanta daily world (atlanta, georgia), october 3, 1933, (city edition)",1933-10-03,"atlanta, georgia",True,english,"fulton county (ga.), african american, fulton county, united states, fulton, african americans, georgia, atlanta, african american newspapers, atlanta (ga.), newspapers",atlanta,georgia,united states,https://tile.loc.gov/image-services/iiif/service:ndnp:gu:batch_gu_bigfoot_ver02:data:sn82015425:00529040325:1933100301:0587/full/pct:3.125/0/default.jpg#h=302&w=237,https://www.loc.gov/item/sn82015425/1933-10-03/ed-1/,1933-10-03,"atlanta, georgia, october 3, 1933",6 pages,eng,atlanta daily world,sn82015425,"atlanta, georgia"
http://www.loc.gov/item/sn85033526/1866-11-29/ed-1/,"the st. cloud journal (st. cloud, minn.), november 29, 1866",1866-11-29,"st. cloud, minn.",True,english,"stearns, minnesota, united states, saint cloud, newspapers, saint cloud (minn.)",saint cloud,minnesota,united states,https://tile.loc.gov/image-services/iiif/service:ndnp:mnhi:batch_mnhi_datsun_ver01:data:sn85033526:00212472542:1866112901:0045/full/pct:3.125/0/default.jpg#h=351&w=273,https://www.loc.gov/item/sn85033526/1866-11-29/ed-1/,1866-11-29,"st. cloud, minn., november 29, 1866",4 pages,eng,the st. cloud journal,sn85033526,"st. cloud, minn."
http://www.loc.gov/item/sn95060694/1946-06-18/ed-1/,"el tucsonense (tucson, ariz.), june 18, 1946",1946-06-18,"tucson, ariz.",True,spanish,"tucson (ariz.), hispanic americans, united states, arizona, pima county, pima, latin american, newspapers, pima county (ariz.), tucson",tucson,arizona,united states,https://tile.loc.gov/image-services/iiif/service:ndnp:az:batch_az_fireagate_ver02:data:sn95060694:00517019446:1946061801:0199/full/pct:3.125/0/default.jpg#h=298&w=229,https://www.loc.gov/item/sn95060694/1946-06-18/ed-1/,1946-06-18,"tucson, ariz., june 18, 1946",4 pages,spa,el tucsonense,sn95060694,"tucson, ariz."
http://www.loc.gov/item/sn86088181/1882-11-02/ed-1/,"san marcos free press (san marcos, tex.), november 2, 1882",1882-11-02,"san marcos, tex.",True,english,"united states, hays, san marcos, texas, newspapers, san marcos (tex.)",san marcos,texas,united states,https://tile.loc.gov/image-services/iiif/service:ndnp:txdn:batch_txdn_ferrari_ver02:data:sn86088181:00200296941:1882110201:0413/full/pct:6.25/0/default.jpg#h=465&w=292,https://www.loc.gov/item/sn86088181/1882-11-02/ed-1/,1882-11-02,"san marcos, tex., november 2, 1882",8 pages,eng,san marcos free press,sn86088181,"san marcos, tex."
http://www.loc.gov/item/sn95047261/1941-06-13/ed-1/,"river junction tribune (river junction, gadsden county, fla.), june 13, 1941",1941-06-13,"river junction, gadsden county, fla.",True,english,"united states, gadsden county, chattahoochee, river junction, river junction (fla.), chattahoochee (fla.), newspapers, gadsden, florida, gadsden county (fla.)","chattahoochee, river junction",florida,united states,https://tile.loc.gov/image-services/iiif/service:ndnp:fu:batch_fu_freeport_ver01:data:sn95047261:00517170094:1941061301:0653/full/pct:6.25/0/default.jpg#h=507&w=358,https://www.loc.gov/item/sn95047261/1941-06-13/ed-1/,1941-06-13,"river junction, gadsden county, fla., june 13, 1941",4 pages,eng,river junction tribune,sn95047261,"river junction, gadsden county, fla."
http://www.loc.gov/item/sn83016672/1892-02-23/ed-1/,"grand rapids herald (grand rapids, mich.), february 23, 1892",1892-02-23,"grand rapids, mich.",True,english,"newspapers, united states, kent, grand rapids, michigan, kent county, grand rapids (mich.), kent county (mich.)",grand rapids,michigan,united states,https://tile.loc.gov/image-services/iiif/service:ndnp:mimtptc:batch_mimtptc_adrian_ver01:data:sn83016672:00415668016:1892022301:0458/full/pct:3.125/0/default.jpg#h=306&w=192,https://www.loc.gov/item/sn83016672/1892-02-23/ed-1/,1892-02-23,"grand rapids, mich., february 23, 1892",8 pages,eng,grand rapids herald,sn83016672,"grand rapids, mich."
http://www.loc.gov/item/sn82014682/1914-12-28/ed-1/,"honolulu star-bulletin (honolulu [oahu, hawaii]), december 28, 1914, (2:30 edition)",1914-12-28,"honolulu [oahu, hawaii]",True,english,"hawaii, united states, honolulu (hawaii), newspapers, honolulu",honolulu,hawaii,united states,https://tile.loc.gov/image-services/iiif/service:ndnp:hihouml:batch_hihouml_heliotrope_ver01:data:sn82014682:0021247101A:1914122801:0748/full/pct:3.125/0/default.jpg#h=265&w=206,https://www.loc.gov/item/sn82014682/1914-12-28/ed-1/,1914-12-28,"honolulu [oahu, hawaii], december 28, 1914",12 pages,eng,honolulu star-bulletin.,sn82014682,"honolulu [oahu, hawaii]"
http://www.loc.gov/item/sn83045555/1899-06-14/ed-1/,"deseret evening news (great salt lake city [utah]), june 14, 1899",1899-06-14,great salt lake city [utah],True,english,"united states, salt lake, salt lake city, utah, salt lake city (utah), newspapers",salt lake city,utah,united states,https://tile.loc.gov/image-services/iiif/service:ndnp:uuml:batch_uuml_hornacek_ver01:data:sn83045555:206534709:1899061401:0128/full/pct:6.25/0/default.jpg#h=303&w=236,https://www.loc.gov/item/sn83045555/1899-06-14/ed-1/,1899-06-14,"great salt lake city [utah], june 14, 1899",8 pages,eng,deseret evening news.,sn83045555,great salt lake city [utah]
http://www.loc.gov/item/sn87062268/1915-02-25/ed-1/,"the pensacola journal (pensacola, fla.), february 25, 1915",1915-02-25,"pensacola, fla.",True,english,"escambia county (fla.), united states, pensacola (fla.), escambia county, pensacola, newspapers, escambia, florida",pensacola,florida,united states,https://tile.loc.gov/image-services/iiif/service:ndnp:fu:batch_fu_arcadia_ver02:data:sn87062268:00415662841:1915022501:0394/full/pct:6.25/0/default.jpg#h=503&w=397,https://www.loc.gov/item/sn87062268/1915-02-25/ed-1/,1915-02-25,"pensacola, fla., february 25, 1915",6 pages,eng,the pensacola journal,sn87062268,"pensacola, fla."
http://www.loc.gov/item/sn82015486/1862-08-21/ed-1/,"white cloud kansas chief (white cloud, kan.), august 21, 1862",1862-08-21,"white cloud, kan.",True,english,"doniphan county, doniphan, united states, kansas, doniphan county (kan.), newspapers, white cloud, white cloud (kan.)",white cloud,kansas,united states,https://tile.loc.gov/image-services/iiif/service:ndnp:khi:batch_khi_allen_ver02:data:sn82015486:00294555614:1862082101:0432/full/pct:6.25/0/default.jpg#h=473&w=331,https://www.loc.gov/item/sn82015486/1862-08-21/ed-1/,1862-08-21,"white cloud, kan., august 21, 1862",4 pages,eng,white cloud kansas chief.,sn82015486,"white cloud, kan."
http://www.loc.gov/item/sn84020630/1901-07-22/ed-1/,"santa fe new mexican (santa fe, n.m.), july 22, 1901",1901-07-22,"santa fe, n.m.",True,"spanish, english","new mexico, united states, santa fe county, santa fe (n.m.), newspapers, santa fe county (n.m.), santa fe",santa fe.,new mexico,united states,https://tile.loc.gov/image-services/iiif/service:ndnp:nmu:batch_nmu_grimes_ver01:data:sn84020630:00415629126:1901072201:0703/full/pct:6.25/0/default.jpg#h=428&w=304,https://www.loc.gov/item/sn84020630/1901-07-22/ed-1/,1901-07-22,"santa fe, n.m., july 22, 1901",4 pages,"eng, spa",santa fe new mexican.,sn84020630,"santa fe, n.m."
http://www.loc.gov/item/sn85033699/1872-10-18/ed-1/,"nashville union and american (nashville, tenn.), october 18, 1872",1872-10-18,"nashville, tenn.",True,english,"united states, tennessee, nashville (tenn.), davidson, newspapers, nashville, davidson county, davidson county (tenn.)",nashville,tennessee,united states,https://tile.loc.gov/image-services/iiif/service:ndnp:tu:batch_tu_elvis_ver01:data:sn85033699:00200293460:1872101801:0369/full/pct:3.125/0/default.jpg#h=284&w=213,https://www.loc.gov/item/sn85033699/1872-10-18/ed-1/,1872-10-18,"nashville, tenn., october 18, 1872",4 pages,eng,nashville union and american.,sn85033699,"nashville, tenn."
http://www.loc.gov/item/sn84024738/1853-04-05/ed-1/,"the daily dispatch (richmond [va.]), april 5, 1853",1853-04-05,richmond [va.],True,english,"united states, richmond (va.), newspapers, virginia, richmond",richmond,virginia,united states,https://tile.loc.gov/image-services/iiif/service:ndnp:vi:batch_vi_manowar_ver01:data:sn84024738:00202190923:1853040501:0315/full/pct:3.125/0/default.jpg#h=257&w=181,https://www.loc.gov/item/sn84024738/1853-04-05/ed-1/,1853-04-05,"richmond [va.], april 5, 1853",4 pages,eng,the daily dispatch,sn84024738,richmond [va.]
http://www.loc.gov/item/sn85055101/1948-02-02/ed-1/,"amerikanski srbobran (pittsburg, pa.;pittsburgh, pa.), february 2, 1948",1948-02-02,"pittsburg, pa.;pittsburgh, pa.",True,"english, serbian","serbian americans, serbian, united states, pittsburgh (pa.), https://id.oclc.org/worldcat/entity/e39pbjtxgqxmwqmjmjjwxrhgrq, pittsburgh, https://id.oclc.org/worldcat/entity/e39pbjkmhvw4rfvxprhvp4vwg3, pennsylvania, allegheny county, allegheny county (pa.), https://id.oclc.org/worldcat/entity/e39pbjxrxbhw3qhvh8dhd6fhyp, https://id.oclc.org/worldcat/entity/e39pbjrrtrm7hc7dmvtffcgyfq, allegheny, newspapers, canada, serbs",pittsburgh,pennsylvania,united states,https://tile.loc.gov/image-services/iiif/service:ndnp:dlc:batch_dlc_friendship_ver03:data:sn85055101:print:1948020201:0001/full/pct:12.5/0/default.jpg#h=393&w=310,https://www.loc.gov/item/sn85055101/1948-02-02/ed-1/,1948-02-02,"pittsburg, pa.;pittsburgh, pa., february 2, 1948",4 pages,"srp, eng",amerikanski srbobran,sn85055101,"pittsburg, pa.;pittsburgh, pa."
http://www.loc.gov/item/sn84027460/1875-12-11/ed-1/,"the kentucky gazette (lexington, ky.), december 11, 1875",1875-12-11,"lexington, ky.",True,english,"fayette county (ky.), kentucky, united states, fayette, fayette county, lexington, newspapers, lexington (ky.)",lexington,kentucky,united states,https://tile.loc.gov/image-services/iiif/service:ndnp:kyu:batch_kyu_frenchie_ver02:data:sn84027460:00516997175:1875121101:0580/full/pct:6.25/0/default.jpg#h=418&w=273,https://www.loc.gov/item/sn84027460/1875-12-11/ed-1/,1875-12-11,"lexington, ky., december 11, 1875",4 pages,eng,the kentucky gazette,sn84027460,"lexington, ky."
http://www.loc.gov/item/sn83025316/1910-05-19/ed-1/,"the daily missoulian (missoula, mont.), may 19, 1910, (morning)",1910-05-19,"missoula, mont.",True,english,"united states, missoula, montana, missoula (mont.), newspapers",missoula,montana,united states,https://tile.loc.gov/image-services/iiif/service:ndnp:mthi:batch_mthi_harlequin_ver01:data:sn83025316:00294554877:1910051901:0300/full/pct:6.25/0/default.jpg#h=425&w=328,https://www.loc.gov/item/sn83025316/1910-05-19/ed-1/,1910-05-19,"missoula, mont., may 19, 1910",12 pages,eng,the daily missoulian.,sn83025316,"missoula, mont."
http://www.loc.gov/item/sn83025182/1864-09-01/ed-1/,"the daily gate city (keokuk, iowa), september 1, 1864",1864-09-01,"keokuk, iowa",True,english,"united states, lee, iowa, keokuk, keokuk (iowa), newspapers",keokuk,iowa,united states,https://tile.loc.gov/image-services/iiif/service:ndnp:iahi:batch_iahi_ivysaur_ver01:data:sn83025182:00279528323:1864090101:0488/full/pct:3.125/0/default.jpg#h=257&w=195,https://www.loc.gov/item/sn83025182/1864-09-01/ed-1/,1864-09-01,"keokuk, iowa, september 1, 1864",4 pages,eng,the daily gate city.,sn83025182,"keokuk, iowa"
http://www.loc.gov/item/sn93051669/1892-11-05/ed-1/,"the dalles times-mountaineer (the dalles, or.), november 5, 1892",1892-11-05,"the dalles, or.",True,english,"dalles, eastern oregon, wasco, united states, wasco county (or.), oregon, wasco county, newspapers, oregon, eastern, dalles (or.)",dalles,oregon,united states,https://tile.loc.gov/image-services/iiif/service:ndnp:oru:batch_oru_jaeger_ver01:data:sn93051669:00200298871:1892110501:0266/full/pct:3.125/0/default.jpg#h=265&w=215,https://www.loc.gov/item/sn93051669/1892-11-05/ed-1/,1892-11-05,"the dalles, or., november 5, 1892",4 pages,eng,the dalles times-mountaineer,sn93051669,"the dalles, or."
http://www.loc.gov/item/sn86063823/1903-10-12/ed-1/,"the roswell daily record (roswell, n.m.), october 12, 1903",1903-10-12,"roswell, n.m.",True,english,"new mexico, united states, chaves county, roswell (n.m.), chaves, roswell, newspapers, chaves county (n.m.)",roswell,new mexico,united states,https://tile.loc.gov/image-services/iiif/service:ndnp:nmu:batch_nmu_graywolf_ver02:data:sn86063823:00296025719:1903101201:0144/full/pct:6.25/0/default.jpg#h=500&w=349,https://www.loc.gov/item/sn86063823/1903-10-12/ed-1/,1903-10-12,"roswell, n.m., october 12, 1903",4 pages,eng,the roswell daily record.,sn86063823,"roswell, n.m."
http://www.loc.gov/item/sn88086023/1910-06-14/ed-1/,"east oregonian : e.o (pendleton, umatilla co., or.;pendleton, or), june 14, 1910, (evening edition)",1910-06-14,"pendleton, umatilla co., or.;pendleton, or",True,english,"umatilla, united states, pendleton (or.), oregon, pendleton, newspapers",pendleton,oregon,united states,https://tile.loc.gov/image-services/iiif/service:ndnp:oru:batch_oru_mallard_ver02:data:sn88086023:00202194679:1910061401:0098/full/pct:6.25/0/default.jpg#h=426&w=290,https://www.loc.gov/item/sn88086023/1910-06-14/ed-1/,1910-06-14,"pendleton, umatilla co., or.;pendleton, or, june 14, 1910",8 pages,eng,east oregonian : e.o.,sn88086023,"pendleton, umatilla co., or.;pendleton, or"
http://www.loc.gov/item/sn92053737/1913-12-24/ed-1/,"east st. louis daily journal (east st. louis, ill.), december 24, 1913",1913-12-24,"east st. louis, ill.",True,english,"united states, east saint louis, illinois, newspapers, saint clair, east saint louis (ill.)",east saint louis,illinois,united states,https://tile.loc.gov/image-services/iiif/service:ndnp:iune:batch_iune_flicker_ver01:data:sn92053737:00542864436:1913122401:0701/full/pct:6.25/0/default.jpg#h=448&w=335,https://www.loc.gov/item/sn92053737/1913-12-24/ed-1/,1913-12-24,"east st. louis, ill., december 24, 1913",8 pages,eng,east st. louis daily journal,sn92053737,"east st. louis, ill."
http://www.loc.gov/item/sn93060356/1951-12-06/ed-1/,"auttaja (ironwood, mich.), december 6, 1951",1951-12-06,"ironwood, mich.",True,finnish,"saint louis (mo.), united states, lutheran church, missouri, saint louis, gogebic, michigan, missouri synod, ironwood (mich.), newspapers, ironwood, gogebic county, gogebic county (mich.), finnish-american ev. lutheran national church","saint louis, ironwood","missouri, michigan",united states,https://tile.loc.gov/image-services/iiif/service:ndnp:mimtptc:batch_mimtptc_kingsley_ver01:data:sn93060356:00279552180:1951120601:0259/full/pct:3.125/0/default.jpg#h=275&w=211,https://www.loc.gov/item/sn93060356/1951-12-06/ed-1/,1951-12-06,"ironwood, mich., december 6, 1951",8 pages,fin,auttaja,sn93060356,"ironwood, mich."
http://www.loc.gov/item/sn82016481/1846-04-27/ed-1/,"arkansas state gazette (little rock, ark.), april 27, 1846",1846-04-27,"little rock, ark.",True,english,"little rock (ark.), arkansas, united states, little rock, pulaski, pulaski county, newspapers, pulaski county (ark.)",little rock,arkansas,united states,https://tile.loc.gov/image-services/iiif/service:ndnp:arhi:batch_arhi_fluorite_ver01:data:sn82016481:00516990715:1846042701:0015/full/pct:6.25/0/default.jpg#h=418&w=293,https://www.loc.gov/item/sn82016481/1846-04-27/ed-1/,1846-04-27,"little rock, ark., april 27, 1846",4 pages,eng,arkansas state gazette,sn82016481,"little rock, ark."
http://www.loc.gov/item/sn83035595/1867-05-17/ed-1/,"delaware gazette (delaware, ohio), may 17, 1867",1867-05-17,"delaware, ohio",True,english,"united states, ohio, delaware, newspapers, delaware (ohio)",delaware,ohio,united states,https://tile.loc.gov/image-services/iiif/service:ndnp:ohi:batch_ohi_julian_ver02:data:sn83035595:00296026645:1867051701:0300/full/pct:6.25/0/default.jpg#h=493&w=422,https://www.loc.gov/item/sn83035595/1867-05-17/ed-1/,1867-05-17,"delaware, ohio, may 17, 1867",4 pages,eng,delaware gazette,sn83035595,"delaware, ohio"
http://www.loc.gov/item/sn83021205/1868-08-08/ed-1/,"worcester daily spy (worcester [mass.]), august 8, 1868",1868-08-08,worcester [mass.],True,english,"united states, massachusetts, worcester (mass.), newspapers, worcester",worcester,massachusetts,united states,https://tile.loc.gov/image-services/iiif/service:ndnp:mb:batch_mb_hera_ver01:data:sn83021205:00517171554:1868080801:0753/full/pct:3.125/0/default.jpg#h=289&w=210,https://www.loc.gov/item/sn83021205/1868-08-08/ed-1/,1868-08-08,"worcester [mass.], august 8, 1868",4 pages,eng,worcester daily spy,sn83021205,worcester [mass.]
http://www.loc.gov/item/sn88078751/1922-08-15/ed-1/,"the democratic banner (mt. vernon, ohio), august 15, 1922",1922-08-15,"mt. vernon, ohio",True,english,"mount vernon (ohio), united states, knox county (ohio), ohio, mount vernon, knox, newspapers, knox county",mount vernon,ohio,united states,https://tile.loc.gov/image-services/iiif/service:ndnp:ohi:batch_ohi_echo_ver01:data:sn88078751:00237282619:1922081501:1009/full/pct:6.25/0/default.jpg#h=394&w=323,https://www.loc.gov/item/sn88078751/1922-08-15/ed-1/,1922-08-15,"mt. vernon, ohio, august 15, 1922",6 pages,eng,the democratic banner,sn88078751,"mt. vernon, ohio"
http://www.loc.gov/item/sn84026355/1899-07-29/ed-1/,"the scranton tribune (scranton, pa.), july 29, 1899, (morning)",1899-07-29,"scranton, pa.",True,english,"united states, lackawanna, scranton, pennsylvania, scranton (pa.), lackawanna county (pa.), newspapers",scranton,pennsylvania,united states,https://tile.loc.gov/image-services/iiif/service:ndnp:pst:batch_pst_atherton_ver01:data:sn84026355:00237281998:1899072901:0238/full/pct:6.25/0/default.jpg#h=453&w=340,https://www.loc.gov/item/sn84026355/1899-07-29/ed-1/,1899-07-29,"scranton, pa., july 29, 1899",12 pages,eng,the scranton tribune.,sn84026355,"scranton, pa."
